"Phase","Area","Workstream","Task","Status","Deployment State","Priority","Notes","Next Step"
"Phase 0","Foundation","Platform Setup","Next.js 16 app structure is in place","Done","On main","P0","Public pages and dashboard shell already exist","Maintain and extend"
"Phase 0","Foundation","Platform Setup","Prisma schema and Postgres integration are in place","Done","On main","P0","Core relational data model exists","Keep schema synced with migrations"
"Phase 0","Foundation","Build System","Production build switched to webpack for stability","Done","Local and expected for next deploy","P0","Local build passes via webpack path","Commit and deploy with next backend batch"
"Phase 0","Foundation","Documentation","Project dossier created","Done","On main","P1","Snapshot-level project documentation exists","Keep updated after major releases"
"Phase 0","Foundation","Documentation","Product overview created","Done","On main","P1","Business-facing project summary exists","Refine for investor/client use if needed"
"Phase 0","Foundation","Documentation","Technical handoff created","Done","On main","P1","Developer-facing handoff doc exists","Update after backend shipping"
"Phase 0","Foundation","Documentation","Platform readiness tracker expanded to full product scope","Done","Local only","P1","Checklist now explicitly tracks missing platform layers like admin, tenant lifecycle, billing, observability, support, and enterprise governance","Keep updated as scope evolves"
"Phase 1","Auth","Authentication","NextAuth credentials login implemented","Done","On main","P0","Credentials flow exists","Keep testing against live DB"
"Phase 1","Auth","Authentication","Google OAuth support path implemented","Done","On main","P1","Provider support exists in code","Add production credentials"
"Phase 1","Auth","Authentication","2FA routes implemented","Done","Mostly local/in repo","P1","Setup, verify, disable, verify-login routes exist","Validate end-to-end with live DB"
"Phase 1","Auth","Authorization","Role model implemented (SUPER_ADMIN, ADMIN, USER)","Done","On main","P0","Role enum and session role flow exist","Expand RBAC per module/action"
"Phase 1","Auth","Security","Password hashing and verification helpers added","In Progress","Local only","P0","Auth hardening is in local worktree","Commit with next auth/backend batch"
"Phase 1B","Admin","Control Plane","Separate /admin control-plane shell implemented","In Progress","Local only","P0","New admin route group and shell exist locally","Validate flow and ship with next backend batch"
"Phase 1B","Admin","Overview","Live admin overview API and page implemented","In Progress","Local only","P0","Overview now reflects real org data and audit activity","Validate against live DB and deploy"
"Phase 1B","Admin","User Management","Workspace user admin page and API expansion implemented","In Progress","Local only","P0","Admins can create, role-manage, and remove org users with founder lock rules","Validate and deploy"
"Phase 1B","Admin","Workspace Controls","Workspace settings admin page and API implemented","In Progress","Local only","P1","Org settings are now split into admin control plane","Validate and deploy"
"Phase 1B","Admin","Security Controls","Admin security page implemented","In Progress","Local only","P1","2FA coverage, privileged users, and audit visibility are surfaced","Validate and deploy"
"Phase 1B","Admin","Platform Governance","Super-admin system page and workspace provisioning route implemented","In Progress","Local only","P0","Founder can create stakeholder workspaces without giving up SUPER_ADMIN","Validate and deploy"
"Phase 2","CRM","Core CRM","Contacts CRUD implemented","Done","On main","P0","API and page support exist","Continue UX improvement"
"Phase 2","CRM","Core CRM","Companies CRUD implemented","Done","On main","P0","API and page support exist","Continue UX improvement"
"Phase 2","CRM","Core CRM","Deals CRUD implemented","Done","On main","P0","API and page support exist","Continue UX improvement"
"Phase 2","CRM","Customization","Custom CRM field system implemented","Done","On main","P1","Supports text, number, currency, date, select, multiselect, checkbox","Improve field editor UX"
"Phase 2","CRM","Automation","CRM follow-up generation endpoint implemented","Done","On main","P1","Follow-up generation route exists","Keep tuning AI quality"
"Phase 2","CRM","Reporting","CRM reports and dashboard views implemented","Done","On main","P1","Reporting surface exists","Improve accuracy/visual polish"
"Phase 3","Accounting","Finance Core","Invoices CRUD implemented","Done","On main","P0","Accounting API routes exist","Continue real-world validation"
"Phase 3","Accounting","Finance Core","Expenses CRUD implemented","Done","On main","P0","Accounting API routes exist","Continue real-world validation"
"Phase 3","Accounting","Reporting","Report export routes implemented","Done","On main","P1","Export and summary endpoints exist","Validate data accuracy with live DB"
"Phase 3","Accounting","Reporting","Digest/reporting endpoints implemented","Done","On main","P1","Digest and summary routes exist","Connect to SMTP for email delivery"
"Phase 4","Operations","Ops Control","Ops command center implemented","Done","On main","P1","Operations route/page exist","Continue UX and live data tuning"
"Phase 4","Operations","Automation","Workflow endpoints implemented","Done","On main","P1","Automation workflow support exists","Add more real workflows"
"Phase 4","Operations","Automation","Playbooks implemented","Done","On main","P1","Playbook route/page exist","Keep expanding playbook library"
"Phase 4","Operations","Governance","Decision trails and rollback routes implemented","Done","On main","P1","Decision trail and rollback endpoints exist","Continue auditability improvements"
"Phase 4","Operations","Governance","Audit logging implemented","Done","On main","P0","Audit helper and route exist","Broaden action coverage"
"Phase 4","Operations","Integrations","Webhook endpoints implemented","Done","On main","P1","Webhook route exists","Lock down and document secrets/rotation"
"Phase 5","Portal","Client Collaboration","Client portal implemented","Done","On main","P1","Portal routes, page, updates, docs, approvals exist","Improve production UX"
"Phase 5","Portal","Client Collaboration","Portal updates implemented","Done","On main","P1","Update routes exist","Continue UI polish"
"Phase 5","Portal","Client Collaboration","Portal documents implemented","Done","On main","P1","Document route exists","Finish real upload path with Cloudinary"
"Phase 5","Portal","Client Collaboration","Portal approvals implemented","Done","On main","P1","Approval route exists","Test approval flows against live DB"
"Phase 6","AI","Assistant Core","/api/ai/chat implemented","Done","On main","P0","Primary AI route exists","Keep prompt and tool quality improving"
"Phase 6","AI","Assistant Core","/api/ai/conversations implemented","Done","On main","P1","Conversation alias route exists","Use for future thread persistence"
"Phase 6","AI","Provider Routing","OpenAI/Anthropic/Gemini provider routing implemented","Done","On main","P0","Provider selection logic exists","Add/verify live keys"
"Phase 6","AI","User Experience","Global AI coach/popover implemented","Done","On main","P1","AI guide is embedded across pages","Refine guidance and humor balance"
"Phase 6","AI","User Experience","AI guided navigation actions implemented","Done","On main","P1","Model can route users to modules","Improve page-aware highlighting"
"Phase 6","AI","Productivity","Email drafting implemented","Done","On main","P1","Email mode exists","Improve draft templates per department"
"Phase 6","AI","Reliability","Fallback behavior for provider/DB outages implemented","Done","On main","P0","Fallback protects UX when systems are unavailable","Reduce robotic fallback tone further"
"Phase 6","AI","Quality","Natural free-form conversation upgraded","Done","On main","P1","Model-first flow replaced rigid menus","Continue real-world prompt tuning"
"Phase 7","Security","Architecture","Security architecture doc created","Done","On main","P1","System architecture doc exists","Maintain as system evolves"
"Phase 7","Security","Architecture","Endpoint inventory doc created","Done","On main","P1","Endpoint inventory exists","Update after new APIs"
"Phase 7","Security","Compliance","NDPA/VAPT hardening plan created","Done","On main","P1","Security roadmap doc exists","Execute the hardening backlog"
"Phase 7","Security","API Docs","OpenAPI spec created","Done","On main","P1","Swagger-importable YAML exists","Keep synchronized with routes"
"Phase 7","Security","API Docs","In-app API docs page implemented","Done","On main","P1","/dashboard/docs/api exists","Use as internal reference"
"Phase 8","HR","Backend Conversion","HR API routes added (employees, payroll, attendance, positions)","In Progress","Local only","P0","Routes exist in local worktree","Apply migration, test, then commit"
"Phase 8","HR","Frontend Rewire","HR page rewritten to call /api/hr/*","In Progress","Local only","P0","UI is being moved off mock/local-only state","Validate with live DB"
"Phase 8","HR","Data Quality","HR scorecard/compliance views present","In Progress","Local only","P1","Support components exist locally","Finish polish and validation"
"Phase 8","Projects","Backend Conversion","Projects API routes added","In Progress","Local only","P0","/api/projects and /api/projects/tasks exist locally","Apply migration, test, then commit"
"Phase 8","Projects","Frontend Rewire","Projects page rewritten to use live API","In Progress","Local only","P0","Project board/task/timeline are wired toward live data","Validate with live DB"
"Phase 8","Inventory","Backend Conversion","Inventory API routes added","In Progress","Local only","P0","Products, stock, orders routes exist locally","Apply migration, test, then commit"
"Phase 8","Inventory","Frontend Rewire","Inventory page rewritten to use live API","In Progress","Local only","P0","Tables are wired toward live data","Validate with live DB"
"Phase 8","Shared Backend","Seed Data","Module seed helper added for HR/Projects/Inventory","In Progress","Local only","P1","Local seed helper exists","Keep only as controlled dev/demo behavior"
"Phase 8","Shared Backend","Access Control","Org ownership checks added to new HR/Projects/Inventory routes","In Progress","Local only","P0","Mutation routes were tightened locally","Ship with backend conversion commit"
"Phase 9","Infrastructure","Database","Pending migration created for HR/Projects/Inventory backend","In Progress","Local only","P0","Migration folder exists locally","Apply migration to active database"
"Phase 9","Infrastructure","Database","Active DATABASE_URL is stable and reachable","Pending","Not complete","P0","Recent Prisma migrate attempts failed with P1001","Fix DB provider/credentials first"
"Phase 9","Infrastructure","Deployment","Admin control-plane batch committed and pushed","Pending","Not started","P0","New /admin shell and APIs are local only","Ship alongside backend conversion or in a clean isolated batch"
"Phase 9","Infrastructure","Deployment","Render deployment synced with new admin control plane","Pending","Not started","P0","Stakeholder admin experience is not live until deploy completes","Deploy after push and smoke test"
"Phase 9","Infrastructure","Deployment","Local HR/Projects/Inventory backend work committed and pushed","Pending","Not started","P0","Worktree is ahead of main","Commit a clean backend batch after DB validation"
"Phase 9","Infrastructure","Deployment","Render deployment synced with latest local backend conversion","Pending","Not started","P0","Render is behind current local backend work","Deploy after commit/push"
"Phase 10","Integrations","Auth","Production Google OAuth credentials configured","Pending","Not complete","P1","Code support exists, env still needs live values","Add production client ID/secret"
"Phase 10","Integrations","Email","SMTP configured for real notifications and report delivery","Pending","Not complete","P1","Nodemailer path exists","Add SMTP env values and test delivery"
"Phase 10","Integrations","Uploads","Cloudinary configured for production uploads","Pending","Not complete","P1","Upload path exists but depends on env","Add Cloudinary env values and test portal/gallery/docs"
"Phase 10","Integrations","AI","Live AI provider keys configured","Pending","Partially complete","P0","Provider routing exists but production keys may not be stable","Set and validate chosen providers"
"Phase 10","Integrations","Payments","Paystack integration configured if required","Pending","Not complete","P2","Env placeholders exist","Decide scope and implement if needed"
"Phase 11","Quality","AI Quality","Continue tuning AI naturalness and business usefulness","Pending","Ongoing","P1","AI is improved but still needs product-quality refinement","Use real user prompts and tighten responses"
"Phase 11","Quality","Security","Execute remaining security hardening/VAPT backlog","Pending","Ongoing","P0","Docs exist but many controls remain to implement","Run phased hardening plan"
"Phase 11","Quality","Operations","Keep docs and OpenAPI spec aligned with shipped code","Pending","Ongoing","P1","Docs now exist and need maintenance discipline","Update docs in every feature batch"
"Phase 11","Quality","Release Discipline","Separate committed production-ready work from local experiments","Pending","Ongoing","P0","Local worktree is carrying many in-progress changes","Ship smaller isolated batches"
"Phase 12","Tenant Lifecycle","Workspace Provisioning","Invite acceptance flow for seeded users implemented","Pending","Not started","P0","Stakeholder admins can be created, but acceptance/onboarding is not finished","Build invite acceptance and completion flow"
"Phase 12","Tenant Lifecycle","Workspace Access","Multi-workspace membership and org switching implemented","Pending","Not started","P0","Founder/support workflows will need to move across workspaces cleanly","Design membership model and switcher"
"Phase 12","Tenant Lifecycle","Workspace Governance","Workspace suspension, archive, and restore controls implemented","Pending","Not started","P1","You need a lifecycle for dormant or non-compliant stakeholder orgs","Add org status controls and UI"
"Phase 12","Tenant Lifecycle","Entitlements","Org-level feature flags and lifecycle states implemented","Pending","Not started","P1","Required for staged rollout and plan control","Add feature flag and org state model"
"Phase 12","Tenant Lifecycle","Authorization","Action-level RBAC matrix enforced across modules","Pending","Not started","P0","Current auth is stronger, but not yet a full action matrix","Define and enforce per-action permissions"
"Phase 13","Commercial","Billing","Seat and entitlement model implemented","Pending","Not started","P1","Stakeholder workspaces need plan-aware limits","Define seat model and enforcement"
"Phase 13","Commercial","Billing","Billing and subscription admin console implemented","Pending","Not started","P1","Admins need visibility into plan and seats","Build billing summary and controls"
"Phase 13","Commercial","Feature Gating","Plan-aware feature gating implemented","Pending","Not started","P1","Needed to sell multiple tiers without code forks","Add entitlements to routes and UI"
"Phase 13","Commercial","Lifecycle","Trial, upgrade, and downgrade flows implemented","Pending","Not started","P2","Commercial readiness improves with self-service lifecycle","Add commercial lifecycle rules"
"Phase 14","Reliability","Observability","Production error tracking and alerting configured","Pending","Not started","P0","You should know when auth, AI, uploads, or DB fail in production","Configure monitoring and alerting"
"Phase 14","Reliability","Observability","Structured logs and uptime monitoring configured","Pending","Not started","P1","Support and operations need visibility into live failures","Add log aggregation and uptime checks"
"Phase 14","Reliability","Async Work","Background jobs and queue system implemented","Pending","Not started","P1","Digests, webhooks, and retries should not depend on request-response timing","Add async job infrastructure"
"Phase 14","Reliability","Recovery","Backup and restore workflow documented and tested","Pending","Not started","P0","Production data safety is not optional","Define backup plan and run restore drills"
"Phase 14","Reliability","Recovery","Incident response runbook operationalized","Pending","Not started","P1","The docs exist, but the operating motion does not yet","Create and test response workflow"
"Phase 15","Data Governance","Import/Export","CSV importers for CRM, HR, inventory, and accounting implemented","Pending","Not started","P1","Real customers will want to move data in fast","Build import tools and mapping UX"
"Phase 15","Data Governance","Import/Export","Admin export center for operational and compliance data implemented","Pending","Not started","P1","Stakeholders will need consistent exports beyond isolated reports","Add central export surface"
"Phase 15","Data Governance","Recovery","Soft delete and record recovery flows implemented","Pending","Not started","P1","Accidental deletion without recovery will hurt trust","Add reversible delete patterns"
"Phase 15","Data Governance","Compliance","Data retention and purge controls implemented","Pending","Not started","P1","Needed for governance and NDPA discipline","Define retention policy and jobs"
"Phase 15","Data Governance","Compliance","NDPA/privacy request workflow implemented","Pending","Not started","P1","Privacy requests should be operational, not only documented","Add request handling workflow"
"Phase 15","Data Governance","Governance","Approval center for sensitive actions implemented","Pending","Not started","P1","High-risk actions need approvals and evidence","Build approval center and audit tie-in"
"Phase 15","Data Governance","Branding","White-label and enterprise branding controls implemented","Pending","Not started","P2","Important for polished stakeholder rollout, but not a launch blocker","Add branding controls later"
"Phase 16","Support","Customer Success","In-product help center and onboarding content implemented","Pending","Not started","P2","Users need a support surface that does not depend on you manually answering everything","Build help center and guides"
"Phase 16","Support","Support Ops","Support impersonation with audit trail implemented","Pending","Not started","P1","Support needs controlled access for troubleshooting","Add audited impersonation or support sessions"
"Phase 16","Support","Customer Success","Customer usage and health analytics implemented","Pending","Not started","P2","Useful for renewals and stakeholder expansion","Add adoption and health reporting"
"Phase 16","Support","Communication","Release notes and changelog workflow implemented","Pending","Not started","P2","Customers should see product progress clearly","Add changelog discipline"
"Phase 16","Go-To-Market","Quality","Accessibility and mobile QA sweep completed","Pending","Not started","P1","Pitching stakeholders on unstable mobile/accessibility experiences is risky","Run QA sweep and fix findings"
"Phase 16","Go-To-Market","Readiness","Stakeholder pitch readiness gate completed","Pending","Not started","P0","You need a formal go/no-go checklist before handing this to serious stakeholders","Use the pitch-readiness document as the gate"
"Phase 17","Brand","Marketing Site","Landing page redesign completed","Pending","Not started","P2","Current landing page is not yet strong enough for premium product positioning","Run a full brand and conversion redesign later"
"Phase 17","Brand","Positioning","Product messaging and trust-signals upgraded","Pending","Not started","P2","The product needs clearer premium positioning for stakeholders and buyers","Rewrite positioning and supporting sections"
